[
  {
    "id": "00000000-0000-4000-8000-000000000070",
    "stage": "publish",
    "idempotency_key": "publish:00000000-0000-4000-8000-000000000001:2026-09-25T12:00:00Z:1.0",
    "attempts": 1,
    "state": "succeeded",
    "error_code": null,
    "cutoff": "2026-09-25T12:00:00Z",
    "created_at": "2026-09-25T12:00:00Z",
    "finished_at": "2026-09-25T12:04:00Z"
  }
]
